ReturnLogic,https://www.crunchbase.com/organization/returnlogic,"Business Intelligence, E-Commerce, Enterprise Software, Logistics, Predictive Analytics, Retail Technology, SaaS, Supply Chain Management","Mechanicsburg, Pennsylvania, United States",2014-01-01,year,11955604,USD,11955604,Intelligent Returns Management Platform for Scaling Ecommerce Brands,"122,440",,"115,060",9,2025-02-24,365608,USD,365608,11955604,USD,11955604,"SaaS Ventures, Cultivation Capital, Mercury, SpringTime Ventures, Stout Street Capital",1,13,1,Peter Sobotta,11-50,"Artificial Intelligence (AI), Commerce and Shopping, Data and Analytics, Hardware, Software, Transportation",,,Active,For Profit,http://www.returnlogic.com,http://twitter.com/returnlogic,https://www.facebook.com/returnlogic,http://www.linkedin.com/company/5114579,"ReturnLogic stands at the forefront, pioneering a revolution in returns management. Our mission is clear and ambitious: to leverage the power of AI and an API-first strategy to transform the way retailers approach returns, turning a traditionally cumbersome process into a strategic asset."
Adora AI,https://www.crunchbase.com/organization/adora-inc,"Artificial Intelligence (AI), Cause Marketing, Charity","Richardson, Texas, United States",2014-02-04,day,160000,USD,160000,Empowering Human Potential through AI-native Innovation,"124,741",,"117,287",1,2015-08-30,160000,USD,160000,160000,USD,160000,,,,2,"Jacob Gresham, Kyle Thomas",1-10,"Artificial Intelligence (AI), Data and Analytics, Other, Sales and Marketing, Science and Engineering, Social Impact, Software",,,Active,For Profit,https://www.adoraos.com/,https://x.com/AskAdoraAI,https://www.facebook.com/askadoraai,https://www.linkedin.com/company/ask-adora-ai/,"At Adora AI, our mission is clear: harness AI to unlock human potential, liberating individuals and organizations from the constraints of repetitive, low-value tasks, and enabling a greater focus on creativity, strategic initiatives, and meaningful human to human engagement. Our integrated, human-centric operating system, Adora AI OS, combines advanced automation, sophisticated AI-native architecture, and unparalleled security into a scalable, modular platform designed explicitly for tangible, real-world impact."
SmartBot360,https://www.crunchbase.com/organization/smartbot360,"Artificial Intelligence (AI), Chatbot, Marketing, Software","Riverside, California, United States",2014-01-01,year,956000,USD,956000,"SmartBot360 is an AI-powered tool to help build, monitor, and control chatbots.","124,838",,"117,377",4,2020-08-10,256000,USD,256000,250000,USD,250000,National Science Foundation,1,1,1,Vagelis Hristidis,1-10,"Artificial Intelligence (AI), Data and Analytics, Sales and Marketing, Science and Engineering, Software",,,Active,For Profit,https://smartbot360.com,,https://www.facebook.com/SmartBot360-280293572441673/,https://www.linkedin.com/company/smartbot360/,"SmartBot360 is a platform to create, manage, and share AI chatbots. empowers customer service agents to increase the number of customers reached by offloading routine interactions to the AI-powered chatbots. They allow monitoring and analyzing ongoing sessions, starting new chatbot campaigns, and directly chatting with the customers."
Klangoo,https://www.crunchbase.com/organization/klangoo,"Analytics, Artificial Intelligence (AI), Content Discovery, Machine Learning, Personalization, SaaS, SEO, Text Analytics","Hoboken, New Jersey, United States",2014-01-01,year,4720000,USD,4720000,Artificial Intelligence company at heart providing Natural Language Processing (NLP) services to a multitude of domains,"126,286",,"118,769",3,2021-10-13,720000,USD,720000,4720000,USD,4720000,"Middle East Venture Partners (MEVP), IM Capital",1,2,4,"Eddy Touma, Johnny Azzi, Romeo Issa, Walid Saba",11-50,"Artificial Intelligence (AI), Commerce and Shopping, Content and Publishing, Data and Analytics, Internet Services, Media and Entertainment, Sales and Marketing, Science and Engineering, Software",,,Active,For Profit,http://www.klangoo.com,https://www.twitter.com/usklangoo,,https://www.linkedin.com/company/klangoo?trk=biz-companies-cym,"Klangoo offers three products based on its patented Natural Language Processing(NLP) engine: Magnet Audience Engagement Solution for Publishers, Brand Safety API for Advertising Operations teams, and a B2C self-service NLP API. Its audience engagement solutions offer personalized recommendations, automated summaries, Meta tags, and entity pages. In addition, the platform provides semantically-driven reports and integrated widget solutions. Klangoo was founded in 2014 by Johnny Azzi, Eddy Touma, Romeo Issa, and Walid Saba and is based in New Jersey."
Sphericam Inc.,https://www.crunchbase.com/organization/sphericam,"Computer Vision, Electronics, Hardware, Mapping Services, Software, Video, Virtual Reality","New York, New York, United States",2014-09-01,month,5507881,USD,5507881,Sphericam is a cutting edge 360º video cameras company. We build tools for professional no-compromise spherical content capture.,"126,811",,"119,275",3,2016-04-20,5000000,USD,5000000,5050000,USD,5050000,"Kingnet, Silicon Gardens Angel Fund",1,2,3,"Jeffrey Martin, Poppo Wit, Servaes Joordens",11-50,"Consumer Electronics, Hardware, Media and Entertainment, Navigation and Mapping, Software, Video",,,Active,For Profit,https://www.mosaic51.com,https://twitter.com/Sphericam,https://www.facebook.com/sphericam,https://www.linkedin.com/company/sphericam,"Sphericam is a hardware company creating a 360-degree camera for filming high-resolution Virtual Reality (VR) content. Technologically, the camera is capable of self-stitching and streaming live 4K video at 60 frames per second and is compatible with VR headsets available at the market. the company aims to become the go-to brand for professional level 360º capture with a diversified product range and unparalleled industry knowledge. Sphericam was founded in 2008 by Jeffrey Martin, based in New York City."
ShopCo Technologies,https://www.crunchbase.com/organization/shopco,"Artificial Intelligence (AI), Browser Extensions, E-Commerce, Information Technology, Internet, Shopping, Web Apps","San Francisco, California, United States",2014-01-01,year,9500000,USD,9500000,ShopCo Technologies is the parent company of the Shop.co universal cart browser extension.,"127,058",,"119,513",3,2017-02-03,7000000,USD,7000000,9500000,USD,9500000,"NRW.BANK, SeedCapital Dortmund, Tripos, seedfeed, Sparkasse Jena",,7,2,"Jay Habib, Manuel Schobel",11-50,"Apps, Artificial Intelligence (AI), Commerce and Shopping, Data and Analytics, Information Technology, Internet Services, Science and Engineering, Software",,,Active,For Profit,http://www.shop.co,https://www.twitter.com/shopdotco,https://www.facebook.com/shopdotco,https://www.linkedin.com/company/shopco,Shop uses Artificial Intelligence to empower online shopping experience for customers. It is a universal shopping cart browser extension that keeps all the items of its users across the web in one spot. Stores can be registered online and without any hassle. It helps its users browse through a wide range of online stores and checkout from one spot. The company gives ability to connect to all its users existing retailer accounts. It also secures data with encryption methods and two-step verifications.  Shop is a U.S.-based company that was founded in 2014 by Jay Habib.
Fysical Labs,https://www.crunchbase.com/organization/fysical,"Artificial Intelligence (AI), Internet of Things, Location Based Services","San Francisco, California, United States",2014-08-01,day,2165000,USD,2165000,Powering better decisions with location data,"129,152",,"121,519",7,2018-01-01,600000,USD,600000,2115000,USD,2115000,"500 Global, CSC Upshot, Blacktop Capital, Bantam Group, Boston Syndicates (BOSS)",,6,3,"Ben Smith, John Livingston Foley III, Justin Mann",1-10,"Artificial Intelligence (AI), Data and Analytics, Internet Services, Navigation and Mapping, Science and Engineering, Software",,,Active,For Profit,https://fysical.com,,,https://www.linkedin.com/company/fysical-labs/,"Fysical helps marketers, investors, AI, AR, and smart cities make better decisions by providing them with location data on where people go. 500 Startups Accelerator 2016 Alumni (~2.5% acceptance rate) Visit us here: https://fysical.com/"
Knowmail,https://www.crunchbase.com/organization/knowmail,"Artificial Intelligence (AI), Collaboration, Enterprise Software","Boston, Massachusetts, United States",2014-01-01,year,4700000,USD,4700000,"Knowmail is a Personalized A.I. Engine designed to help you focus, save time and be more successful.","129,643",,"121,996",6,2018-12-01,,,,4700000,USD,4700000,"Gaingels, CE Ventures (CEIIF), 2B Angels, AfterDox, Microsoft ScaleUp Tel Aviv",5,8,4,"Avi Mandelberg, Haim Senior, Oded Avital, Ran Achituv",11-50,"Artificial Intelligence (AI), Data and Analytics, Other, Science and Engineering, Software",,,Active,For Profit,https://www.theproductive.me,https://twitter.com/knowmail,https://www.facebook.com/knowmail,https://www.linkedin.com/company/knowmail,"Knowmail is an artificial intelligence engine that learns your work habits as to help you focus, save time and improve your overall email and messaging experience to become more successful."
Reveel Technologies,https://www.crunchbase.com/organization/reveelapp,"Advertising Platforms, Artificial Intelligence (AI), Digital Media, Email Marketing, Machine Learning, Mobile Advertising, Outdoor Advertising, Social Media Advertising, Video, Video Advertising","San Francisco, California, United States",2014-02-26,day,2720000,USD,2720000,"The first platform that provides audiences an interactive experience from print, digital, video and broadcast media. Explore, learn and buy!","129,720",,"122,069",5,2018-02-01,500000,USD,500000,2220000,USD,2220000,"Cervin Ventures, Tech Wildcatters, DPG Investments, 3R Family Trust, Dave Hanson",,8,4,"Aljaz Andrejas, Kristijan Puksic, Matija Vrbovsek, Rok Ajdnik",11-50,"Advertising, Artificial Intelligence (AI), Data and Analytics, Media and Entertainment, Sales and Marketing, Science and Engineering, Software, Video",,,Active,For Profit,https://reveel.it,https://twitter.com/Reveel_it,https://www.facebook.com/reveel.it/,https://www.linkedin.com/company/10260856?trk=tyah&trkInfo=clickedVertical%3Acompany%2CclickedEntityId%3A10260856%2Cidx%3A2-3-4%2CtarId%3A1478781846999%2Ctas%3Areveel,"Join the media REVEELution! Reveel is the first company to allow audiences to view an interactive media experience from print, digital, video and broadcast media on any browser – without downloading an app or producing additional creative.  Reveel's patent pending cloud-based platform allows brands, agencies and media outlets to increase audience engagement and revenue by seizing the moment of interest and converting it into measurable action.  Consumers go to Reveel.it on their mobile browser and snap a photo of print or broadcast media or click on digital media displayed on websites or online video to explore, learn and buy. Anyone can create a custom Reveel landing page online in minutes, then publish it across media channels so it can be viewed on mobile and desktop devices."
Pine Biotech,https://www.crunchbase.com/organization/pine-biotech,"Analytics, Big Data, Bioinformatics, Biotechnology, Health Care, Software","New Orleans, Louisiana, United States",2014-09-01,day,1025000,USD,1025000,Pine Biotech brings computational big-data analysis tools to the Agrotech and Biotech industries to address industry-specific challenges.,"130,903",,"123,202",1,2017-06-20,1025000,USD,1025000,1025000,USD,1025000,,,,1,Elia Brodsky,1-10,"Biotechnology, Data and Analytics, Health Care, Science and Engineering, Software",,,Active,For Profit,http://pine-biotech.com,https://www.twitter.com/pinebiotech,https://www.facebook.com/pinebiotech,https://www.linkedin.com/company/pine-biotech,"Pine Biotech was Incorporated in September 2014, and moved into the New Orleans Bioinnovation Center in 2016. Pine Biotech is commercializing a machine learning biomedical data analysis platform, T-BioInfo, in collaboration with the Tauber Bioinformatics Research Center and the University of Haifa. The platform is designed to serve unmet needs in clinical studies, academic research and education. This solution is different than other biomedical analysis software currently available. The platform enables researchers to conduct comprehensive analysis of large data using an intuitive interface. Molecular data reveals important mechanisms of actions that are best studied as a system, making this integrative approach critical for understanding and treating disease. The machine learning platform utilizes algorithms developed over years of research and trained in many academic projects."
Predicta,https://www.crunchbase.com/organization/predicta-2,"Analytics, Artificial Intelligence (AI), Brand Marketing, Business Intelligence, Market Research, Marketing, Product Design, Product Research, Social Media Marketing, Software","Mcminnville, Oregon, United States",2014-01-01,year,1100997,USD,1100997,"Predicta delivers actionable insights to brands by analyzing data from social media, reviews, and blogs within market categories.","130,941",,"123,240",1,2018-08-24,1100997,USD,1100997,1100997,USD,1100997,,,,2,"Nicolas Braem, Roger Lang",11-50,"Artificial Intelligence (AI), Data and Analytics, Design, Sales and Marketing, Science and Engineering, Software",,,Active,For Profit,http://www.predicta.com/,https://twitter.com/predictainc,https://www.facebook.com/predictainc/,https://www.linkedin.com/company/predicta-io/,"Predicta applies artificial intelligence to consumer-generated content for detailed brand analysis and automated marketing intelligence. Simply put, Predicta generates insights for consumer products brands by analyzing and interpreting online consumer conversations about the brand, product, and competitor's brands and products. Predicta accomplishes this automatically and continuously using advanced AI algorithms. As industries change, as consumer sentiment shifts, and as new products are released, Predicta generates automated SWOT analyses for brands and products over time — based on real customer reviews, professional reviews, blogs, forums, social media, and more — distilling them into intuitive and actionable data visualizations. These market insights provide a source of real consumer insights, based on genuine, bias-free consumer-generated content."
Symbio Robotics,https://www.crunchbase.com/organization/symbio-robotics,"Artificial Intelligence (AI), Industrial Automation, Machine Learning, Robotics, Software","Emeryville, California, United States",2014-07-31,day,29250000,USD,29250000,Symbio Robotics is developing robotic systems and software for advanced manufacturing.,"131,480",,"123,763",5,2021-02-24,14600000,USD,14600000,29150000,USD,29150000,"Andreessen Horowitz, Eclipse Ventures, The House Fund, ACME Capital, SkyDeck Berkeley",4,9,2,"Brandon Pereira, Maxwell Reynolds",11-50,"Artificial Intelligence (AI), Data and Analytics, Hardware, Manufacturing, Science and Engineering, Software",,,Active,For Profit,https://symb.io,,,https://www.linkedin.com/company/symbio-robotics/,"Symbio Robotics develops artificial intelligence software to improve the real-time control of industrial robots. It was founded in 2014 and is based in Emeryville, California."
KickView,https://www.crunchbase.com/organization/kickview,"Machine Learning, Sensor, Software, Video","Greenwood Village, Colorado, United States",2014-09-13,day,895000,USD,895000,KickView provides advanced sensor signal processing and machine learning applications for the Defense and Space industry.,"132,241",,"124,500",2,2017-12-28,480000,USD,480000,480000,USD,480000,,,,1,David Ohm,11-50,"Artificial Intelligence (AI), Data and Analytics, Hardware, Media and Entertainment, Software, Video",,,Active,For Profit,http://kickview.com/,,,https://www.linkedin.com/company/kickview-corporation,KickView provides advanced sensor signal processing and machine learning applications for the Defense and Space industry. We automate the process of extracting operational intelligence from sensor data.
MPIRICA Health Analytics,https://www.crunchbase.com/organization/mpirica-health-analytics,"Analytics, Artificial Intelligence (AI), Health Care, Machine Learning, Medical","Bellevue, Washington, United States",2014-04-04,day,6600000,USD,6600000,MPIRICA Health Analytics offers an AI-powered outcomes-based scoring system for patients to evaluate medical providers based on data.,"133,180",,"125,406",3,2017-04-25,4600000,USD,4600000,6600000,USD,6600000,"Cognitiv Ventures, McQuinn Trust",2,2,2,"Chris Diede, Shakil Haroon",1-10,"Artificial Intelligence (AI), Data and Analytics, Health Care, Science and Engineering, Software",,,Active,For Profit,https://www.mpirica.com,https://twitter.com/mpiricahealth,,https://www.linkedin.com/company/mpirica-health-analytics,"MPIRICA Health Analytics operates as a digital health company that utilizes machine learning, backed by a robust methodology, to scores hospitals and surgeons based on objective clinical outcomes. Its cloud-based platform and API helps patients and payers, especially self-insured employers, avoid surgery risks and costs.  The company was founded in 2014 and is headquartered in Bellevue, Washington."
"KPI Ninja, Inc.",https://www.crunchbase.com/organization/kpi-ninja-llc,"Analytics, Data Integration, Data Mining, Data Visualization, Health Care, Natural Language Processing, Software","Lincoln, Nebraska, United States",2014-06-02,day,855000,USD,855000,Leader in healthcare analytics and performance improvement that accelerates the achievement of strategic goals.,"133,374",,"125,593",2,2019-07-31,855000,USD,855000,855000,USD,855000,"Invest Nebraska, Nebraska Angel Network, LaunchYU",1,3,4,"Michael Hein, MD, MS, MHCM, Naren Parimi, Vijay Musunuru, Vineeth Yeddula",11-50,"Artificial Intelligence (AI), Data and Analytics, Design, Health Care, Information Technology, Software",,,Closed,For Profit,http://kpininja.com,https://twitter.com/kpininja,https://www.facebook.com/kpininja/?ref=bookmarks,https://www.linkedin.com/company/kpi-ninja/,"KPI Ninja, a leader in healthcare analytics and performance improvement, is a healthcare technology and consulting company that accelerates the achievement of strategic goals through a better means of managing Key Performance Indicators (KPI’s). KPI Ninja is one of the fastest growing healthcare analytics company in the Midwest region.  Founded in 2014, KPI Ninja's mission is to improve the health of the communities. We do that by partnering with Health Information Exchange (HIE) companies, Health Systems, Critical Access Hospitals, Clinics, and Direct Primary Care (DPC) organizations. We also partner with other healthcare technology companies to build custom analytics applications to solve their data needs.  KPI Ninja is defined by our unique culture - our goal is not to just create dashboards and insights through data, but to partner with our customers to actually improve the outcomes that matter to them. We encourage our teams to be bold and solve complex problems that our customers care most about. We work in small teams and move swiftly to develop new solutions, constantly iterating. "
metacog,https://www.crunchbase.com/organization/metacog-inc,"Analytics, Artificial Intelligence (AI), Augmented Reality, Big Data, Education, Machine Learning, Skill Assessment, Virtual Reality","Worcester, Massachusetts, United States",2014-04-01,day,3600000,USD,3600000,Metacog is a PaaS-based deep learning analytics platform that is accessible via a series of APIs.,"133,510",,"125,721",2,2015-11-12,1600000,USD,1600000,3600000,USD,3600000,,,,3,"Douglas Stein, Owen Lawlor, Victoria Porras",11-50,"Artificial Intelligence (AI), Data and Analytics, Education, Hardware, Science and Engineering, Software",,,Closed,For Profit,http://www.metacog.com,https://twitter.com/Metacoginc,https://www.facebook.com/metacoginc,https://www.linkedin.com/company/5263379,"Metacog is a PaaS-based deep learning analytics platform that is accessible via a series of APIs. Users can stream their data through an instrumentation SDK and easy API; store and manage anonymized data in the metacog cloud platform; and make intelligent products with real-time analytics and automated scoring.  Metacog was founded by Victoria Porras in April 2014 and is based in Worcester, Massachusetts."
Verse.ai,https://www.crunchbase.com/organization/agentology,"Artificial Intelligence (AI), Lead Management, Marketing, Marketing Automation, Messaging, Sales Automation, SMS, Software","San Diego, California, United States",2014-01-01,day,13300000,USD,13300000,The most powerful AI platform for business conversations,"136,073",,"128,191",4,2018-04-17,9000000,USD,9000000,13300000,USD,13300000,"Defy.vc, Freestyle Capital, Moderne Ventures, OurCrowd, Silicon Valley Bank",3,9,2,"Avi Tal, David Tal",51-100,"Artificial Intelligence (AI), Data and Analytics, Information Technology, Internet Services, Messaging and Telecommunications, Sales and Marketing, Science and Engineering, Software",,,Active,For Profit,https://www.verse.ai,https://twitter.com/VerseAI_x,https://www.facebook.com/officialverseai,https://www.linkedin.com/company/28456639/,"The only solution that combines powerful AI with real people and enables conversations through the most powerful communication channels: SMS, email, and phone — so you can keep costs low, sales teams happy, and delight customers at every stage of their journey."
Somabar,https://www.crunchbase.com/organization/somabar,"Artificial Intelligence (AI), Food and Beverage, Hospitality, Hotel, Restaurants, Travel","Los Angeles, California, United States",2014-01-01,year,2095000,USD,2095000,"Somabar is an automated bartending assistant for hotels, restaurants, lounges, and bars.","136,278",,"128,389",4,2020-06-30,,,,230000,USD,230000,"Tech Coast Angels, Grant Van Cleve, HBS Alumni Angels",2,3,2,"Chris Hameetman, Dylan Lowe",1-10,"Artificial Intelligence (AI), Data and Analytics, Food and Beverage, Science and Engineering, Software, Travel and Tourism",,,Active,For Profit,https://www.somabar.com/,https://www.twitter.com/somabar,https://www.facebook.com/Somabar/,https://www.linkedin.com/company/somabar/,"Somabar is a robotic bartending assistant that contains an unlimited and customizable digital bar menu able to make any listed cocktail in 10 seconds from the Somabar machine. The technology features automated cleaning and is virtually indestructible, rated for 1500 hours of continual use, the equivalent of 500,000 drinks. Industry beta testing conducted at various restaurant locations in Los Angeles has indicated that Somabar increases beverage revenue by 30% (on average) and decreases beverage labor costs by 65% (on average)."
Intellivisit,https://www.crunchbase.com/organization/elli-health,"Artificial Intelligence (AI), Health Care, Hospital, Medical","Madison, Wisconsin, United States",2014-01-01,year,5057665,USD,5057665,Intellivisit is a virtual care delivery platform that connects individuals and local providers for the treatment of minor illnesses.,"136,568",,"128,666",7,2019-09-26,691647,USD,691647,5057665,USD,5057665,"Wisconsin Investment Partners, Wisconsin Super Angel Fund, SymphonyAlpha Ventures, Tommy Thompson",,4,3,"J. Michael Eaton, Jay Mason, Jeff Miller",1-10,"Artificial Intelligence (AI), Data and Analytics, Health Care, Science and Engineering, Software",,,Active,For Profit,http://intellivisit.com/,http://twitter.com/intellivisit,http://www.facebook.com/Intellivisit,https://www.linkedin.com/company/elli-health,"Intellivisit is a virtual care delivery platform that connects individuals and local providers for the treatment of minor illnesses or redirection to the most appropriate care setting. Their technology leverages artificial intelligence and an asynchronous communication model to deliver safe, scalable, and convenient virtual care. The company was founded in 2014."
Podium Data,https://www.crunchbase.com/organization/podium-data,"Analytics, Cyber Security, Data Management, Enterprise, Information Technology, Intelligent Systems","Lowell, Massachusetts, United States",2014-01-01,year,11700000,USD,11700000,Podium Data uses big data technologies to redefine the enterprise data management.,"136,852",,"128,940",2,2016-09-26,9700000,USD,9700000,11700000,USD,11700000,"Dolby Family Ventures, CVP Management, Malibu Ventures",1,3,2,"Paul Barth, Steve Richards",11-50,"Artificial Intelligence (AI), Data and Analytics, Information Technology, Other, Privacy and Security, Science and Engineering",,,Closed,For Profit,http://www.podiumdata.com/,https://twitter.com/podiumdata,,https://www.linkedin.com/company/5232953,"Podium Data uses big data technologies to redefine the enterprise data management. Podium dramatically accelerates time-to-answer with a secure, self-service platform that delivers immediate business impact."
