Kono,https://www.crunchbase.com/organization/konolabs-inc-,"Artificial Intelligence (AI), Machine Learning, Productivity Tools","San Francisco, California, United States",2014-11-13,day,880000,USD,880000,Kono is an AI driven scheduling assistant for enterprises.,"62,998",,"58,186",4,2018-09-13,120000,USD,120000,880000,USD,880000,"Techstars, 500 Global, SAP.iO, FuturePlay, Mashup Ventures",,7,3,"Jaehoon Choi, Jung-hee Ryu, YJ Min",11-50,"Artificial Intelligence (AI), Data and Analytics, Science and Engineering, Software",,,Active,For Profit,https://kono.ai,https://twitter.com/officialkono,https://www.facebook.com/officialkono,https://www.linkedin.com/company/konolabs-inc-,"Kono is an Artificial Intelligence (AI) driven scheduling service platform. Based on its NLU for scheduling and ML based engine, it has been providing various interfaces such as email bot, Slack bot and Facebook messenger bot for scheduling meetings & appointments. Konolabs achieved ISO 27001/27018, the most widely recognized standard internationally for security control requirements within Information Security Management Systems (ISMS) and personally identifiable information (PII) in cloud. More info : https://kono.ai"
TravelWits,https://www.crunchbase.com/organization/travelwits,"Artificial Intelligence (AI), Business Travel, Leisure, Tourism, Travel","Pittsburgh, Pennsylvania, United States",2014-01-01,year,1110000,USD,1110000,TravelWits is a travel tech startup that uses AI to find door to door itineraries optimized around business meeting times and locations,"63,194",,"58,373",5,2018-06-28,50000,USD,50000,760000,USD,760000,"Innovation Works, AlphaLab, The Robotics Hub, Coal Hill Ventures, Urban Redevelopment Authority of Pittsburgh",2,5,3,"Alla Safonova, Arman Bimatov, Maxim Likhachev",1-10,"Artificial Intelligence (AI), Community and Lifestyle, Data and Analytics, Science and Engineering, Software, Travel and Tourism",,,Active,For Profit,http://www.travelwits.com/,https://twitter.com/travelwitscom,https://www.facebook.com/TravelWits,https://www.linkedin.com/company/travelwits,"TravelWits, LLC is a Pittsburgh-based company whose goal is to help travelers find cheaper and more convenient ways to travel, both for business and leisure. TravelWits uses AI to find door to door itineraries optimized for meeting times and locations while saving companies money with an employee incentives and providing a lightweight way to manage travel policies. Our team consists of 3 co-founders. Maxim Likhachev (Professor at CMU) is a world-leading expert in real-time cost optimization and AI. This expertise is the key to developing the company’s unique technology. Arman Bimatov (BS in CS) and Alla Safonova (PhD in CS from CMU) have 30+ years of experience in web development. We are being advised by a reg. president of one of the largest TMCs on the market (20+ years of exp. in the travel industry)."
Uplevel Security,https://www.crunchbase.com/organization/uplevel-security,"Cloud Security, Cyber Security, Data Visualization, Intelligent Systems, Machine Learning","New York, New York, United States",2014-01-01,year,5322824,USD,5322824,Uplevel Security offers adaptive system of intelligence that uses graph theory and machine learning to modernize security operations.,"63,636",,"58,800",4,2018-06-21,,,,5322824,USD,5322824,"First Round Capital, Work-Bench, Aspect Ventures, CSC Upshot, Fitz Gate Ventures",1,12,2,"Elisabeth Maida, Roselle Safran",11-50,"Artificial Intelligence (AI), Data and Analytics, Design, Information Technology, Privacy and Security, Science and Engineering, Software",,,Active,For Profit,http://www.uplevelsecurity.com/,https://twitter.com/uplevelsecurity,,https://www.linkedin.com/company/5384680,"Uplevel Security is the industry’s first adaptive system of intelligence that uses graph theory and machine learning to modernize security operations. Uplevel Security ingests and contextualizes incoming and historical security data, allowing the past to inform the present and the present to inform the past, which predicts how attacks may manifest in the future.  Enterprises rely on Uplevel Security to activate intelligence from the security stack, provide a system of record for security data and become stronger with every attack."
Revealix,https://www.crunchbase.com/organization/revealix,"Artificial Intelligence (AI), Health Care, Medical, Software","Austin, Texas, United States",2014-01-01,year,120000,USD,120000,Revealix develops a computer vision and AI enabled software that helps clinical teams detect skin diseases.,"63,850",,"59,001",2,2024-09-27,,,,120000,USD,120000,"Techstars, Springboard Enterprises",2,2,3,"Adrianna Cantu, Gary Johnson, Stuart Rench",1-10,"Artificial Intelligence (AI), Data and Analytics, Health Care, Science and Engineering, Software",,,Active,For Profit,https://revealix.com/,https://twitter.com/Revealix,,https://www.linkedin.com/company/revealix,"Revealix is a developer of an analytics medical software designed to detect skin diseases. The company's software monitors and analyzes for diabetic limb complications in the palm of the hand by affordable monitoring tools via a web-based analytics platform, enabling healthcare providers to detect the earliest phases of skin and wound complications."
PingThings,https://www.crunchbase.com/organization/pingthings,"Analytics, Artificial Intelligence (AI), Big Data, Energy, Energy Management, GovTech, Internet of Things, Machine Learning, Predictive Analytics, Software","Anaheim, California, United States",2014-04-21,day,5639249,USD,5639249,"PingThings is a venture-backed software company, brings best-of-breed big-data software and data science techniques to the utility industry.","64,592",,"59,708",6,2023-01-01,,,,5639249,USD,5639249,"Oxonian Ventures, Double M Partners, GE Ventures, The K Fund, Stuart Porter",,5,2,"Jerry Schuman, Rich Sootkoos",1-10,"Artificial Intelligence (AI), Data and Analytics, Energy, Government and Military, Information Technology, Internet Services, Science and Engineering, Software",,,Active,For Profit,https://www.pingthings.io/,http://twitter.com/pingthingsIO,,http://www.linkedin.com/company/pingthings,"PingThings brings real-time big-data technology and an innovative solution to machine-learning for physical systems together to transform the management of the state of the electric utility grid and high-value industrial assets such as GSU transformers and step-down transformers. PingThings' PredictiveGrid technology is designed from the ground up with sensor analytics in mind, focusing on storing and manipulating time-series data and modeling complex relationships between synchrophasors' high-resolution signals."
Simility,https://www.crunchbase.com/organization/simility,"Analytics, Artificial Intelligence (AI), Fraud Detection, Machine Learning, Real Time","Palo Alto, California, United States",2014-05-01,day,24700000,USD,24700000,"Simility helps companies prevent fraud in real-time with machine learning, big data analytics, and data visualization capabilities.","64,689",,"59,794",4,2017-12-12,17500000,USD,17500000,24700000,USD,24700000,"Accel, Trinity Ventures, Array Ventures, PayPal Ventures, The Valley Fund",3,6,3,"Kedar Samant, Rahul Pangam, Uttam Phalnikar",11-50,"Artificial Intelligence (AI), Data and Analytics, Financial Services, Other, Payments, Privacy and Security, Science and Engineering, Software",,,Closed,For Profit,http://simility.com,https://twitter.com/simility,https://www.facebook.com/simility,http://linkedin.com/company/simility,"Simility helps companies prevent fraud in real-time with machine learning, big data analytics, and data visualization capabilities. It levels the playing field against even the most sophisticated fraud ring by enabling analysts to create and configure detection mechanisms without having to write one line of code. It is free to analyze trends and test insights at will, analysts can now match fraudster's move for move."
Platina Systems,https://www.crunchbase.com/organization/platina-systems,"Analytics, Computer, Infrastructure, Internet, Machine Learning, Software","Santa Clara, California, United States",2014-11-01,month,24500000,USD,24500000,Maximize your digital assets.,"65,048",,"60,142",2,2019-02-01,11200000,USD,11200000,24500000,USD,24500000,"WI Harper Group, Alibaba Entrepreneurs Fund, DOT Capital, The Valley Fund, Orbit Venture Partners",2,5,2,"Frank Yang, Mark Yin",11-50,"Artificial Intelligence (AI), Consumer Electronics, Data and Analytics, Hardware, Internet Services, Other, Software",,,Active,For Profit,http://www.platinasystems.com/,https://twitter.com/PlatinaSystems,,https://www.linkedin.com/company/platina-systems,"Platina Systems is an infrastructure management company that activates the value of data by simplifying infrastructure operations - at a fraction of the cost. By converging scalable compute within storage, organizations can deploy and manage systems for AI and active archives, simplify on-premise customer deployments and enable developers to focus on development and innovation instead of the operational efforts to manage clusters.   For the world’s largest enterprises, Platina Systems technology minimizes data movement, extracts long term value from their digital assets and reduces the time and expertise needed to implement modern cloud-like infrastructure."
Codio,https://www.crunchbase.com/organization/codio,"Analytics, Artificial Intelligence (AI), E-Learning, EdTech, Education, IaaS, Software","Cambridge, Massachusetts, United States",2014-01-01,year,3535182,GBP,5569000,The evidence-based learning platform for computer science & tech skills education.,"65,428",,"60,501",8,2016-06-07,395000,GBP,574247,3535182,GBP,5569000,,,,2,"Freddy May, Phillip Snalune",11-50,"Artificial Intelligence (AI), Data and Analytics, Education, Science and Engineering, Software",,,Active,For Profit,http://www.codio.com,http://twitter.com/CodioHQ,http://www.facebook.com/pages/Codio/164778707006897,https://www.linkedin.com/company/codio/,"Codio is the evidence-based learning platform for computer science & tech skills education, enabling educators to teach more effectively whilst measurably impacting student outcomes through a combination of texts & learning tools including highly immersive hands-on virtual labs, and AI-enhanced support. Codio's platform is a unique combination of previously disparate and disjointed technologies, including cloud containers for virtual hands-on labs, interactive texts, assessment engines and auto-grading, and advanced AI-driven learning support and analytics. Codio addresses three core markets for education: i) schools and higher education institutions, ii) boot camps and career tech skills training partners, and iii) course content MOOC platforms."
First,https://www.crunchbase.com/organization/first-2,"Big Data, Computer, Predictive Analytics, Real Estate, SaaS, Software","Durham, North Carolina, United States",2014-01-01,year,8250843,USD,8250843,First is a software company that uses artificial and predictive intelligence on when and why people move to predict sales and marketing.,"65,562",,"60,625",3,2018-05-22,5000000,USD,5000000,8250843,USD,8250843,"Sovereign’s Capital, MATH Venture Partners, IDEA Fund Partners, Nine Four Ventures, Charlotte Angel Fund",4,7,2,"Jess Martin, Mike Schneider",11-50,"Artificial Intelligence (AI), Consumer Electronics, Data and Analytics, Hardware, Real Estate, Software",,,Active,For Profit,http://first.io,https://twitter.com/FirstHQ,https://www.facebook.com/FirstHQ/,https://www.linkedin.com/company/first-/,"First is a software company that uses artificial and predictive intelligence on when and why people move to predict sales and marketing. It brings predictive marketing to real estate. Fundamentally changing how service providers find their next customer.  They discover when and why people will buy or sell a house, so they can connect realtors with new clients at the perfect time. Thus, the company predicts who will sell by tracking 700+ signals across 214 million people nationwide."
Wyzerr,https://www.crunchbase.com/organization/wyzerr,"Artificial Intelligence (AI), Computer, Market Research","Covington, Kentucky, United States",2014-06-04,day,2075000,USD,2075000,"We build artificial intelligence to turn customer, employee, and consumer feedback data into business tasks.","65,796",,"60,845",4,2016-05-11,1500000,USD,1500000,2075000,USD,2075000,"Connetic Ventures, Rough Draft Ventures, StartFast Ventures, The Brandery",1,4,2,"Bjorn Simmons, Natasia Malaihollo",1-10,"Artificial Intelligence (AI), Consumer Electronics, Data and Analytics, Design, Hardware, Science and Engineering, Software",,,Active,For Profit,http://www.Wyzerr.com,http://twitter.com/wyzerr,http://www.facebook.com/wyzerr,http://www.linkedin.com/company/wyzerr,"Every brand has a vision for growth and expansion. The intricacies of growing a brand are complex but the underlying mechanism is simple: keep current consumers happy while consistently obtaining new consumers. The key for a successful brand to make consumers happy is to know when they become unhappy. Consumer feedback is gold. When consumers share their story, they’re not just sharing pain points. They’re actually providing personal insight on how to make your product, service, and brand better. Wyzerr makes it easier for  brands to obtain consumer feedback in real time by integrating customer feedback into daily operations. This allows brands to track productivity and efficiency in real-time. With Wyzerr, brands can immediately correct any customer issues, address potential “fires” before they spread, and validate changes in products & services. By making small but consistent incremental improvements, brands are in a better position to scale upwards towards success!"
"Waggl, Inc.",https://www.crunchbase.com/organization/waggl,"Analytics, Artificial Intelligence (AI), Crowdsourcing, Human Resources, Information Technology, Internet, Real Time","San Francisco, California, United States",2014-01-01,year,12485000,USD,12485000,Waggl is a real-time employee feedback platform that delivers actionable insights through employee voice.,"65,952",,"60,988",6,2021-03-24,2500000,USD,2500000,9385000,USD,9385000,"FundersClub, SaaS Capital, First Analysis, Lighter Capital, Interlock Partners",2,10,4,"Adam Tanner, David Timby, Drew Batshaw, Michael Papay",11-50,"Administrative Services, Artificial Intelligence (AI), Data and Analytics, Information Technology, Internet Services, Other, Science and Engineering, Software",,,Active,For Profit,http://www.waggl.com/,http://twitter.com/waggl_it,http://www.facebook.com/waggl.it,http://www.linkedin.com/company/waggl,"Waggl is the #1 platform for real-time feedback, powered by employee voice. Organizations know that high performance is driven by engaged people, not measurement and numbers alone. Waggl delivers leaders real-time insight, deep alignment, informed decision-making and speed to action. Behavior change through participation is produced when employees use Waggl for meaningful inclusion, transparent dialogue, and an opportunity for unique, visible contribution.  With a highly seasoned management team and a Board including esteemed executives from Glassdoor, SuccessFactors, and Coupa, Waggl is an innovative industry leader helping companies of all sizes to succeed by informed decision-making and engaged employees, including MGM Resorts International, UCHealth, BD, and Juniper Networks. For more information, please visit: www.waggl.com/. "
Talentpair,https://www.crunchbase.com/organization/talentpair,"Artificial Intelligence (AI), Human Resources, Recruiting, Software","Boise, Idaho, United States",2014-01-01,year,3764879,USD,3764879,"Talentpair is the World's Largest Hiring and Talent Management Community for Candidates, Hiring Teams and Growth Partners.","66,181",,"61,203",1,2022-12-25,3764879,USD,3764879,3764879,USD,3764879,Quest Groups,1,1,1,Joe Kosakowski,11-50,"Administrative Services, Artificial Intelligence (AI), Data and Analytics, Professional Services, Science and Engineering, Software",,,Active,For Profit,http://www.talentpair.com,https://twitter.com/talentpair ,https://www.facebook.com/talentpair.inc,https://www.linkedin.com/company/talentpair,"Talentpair is an advanced AI talent community. We speak Hiring and Talent Management for Candidates, Hiring Teams and Growth Partners. Awarded the 2022 and 2021 RemoteTech Job Marketplace of the Year, Talentpair is the first, end-to-end, hiring and talent management community ecosystem for all.  Talentpair combines proprietary, domain specific hiring data (Perry.ai) and an open ecosystem of Generative AI partners, including OpenAI APIs. Perry.ai speaks the recruiting language fluently, increasing the pace of data events. The ecosystem is trained on 515 GB of data and has produced over 5 billion data points to date. We know the importance of balancing human and machine. Building world-class teams is not about jobs on a board. It’s about people."
Skymind,https://www.crunchbase.com/organization/skymind,Artificial Intelligence (AI),"San Francisco, California, United States",2014-01-01,year,14500000,USD,14500000,"Skymind created Deeplearning4j, the open-source deep-learning framework for the JVM.","66,208",,"61,229",3,2019-03-21,11500000,USD,11500000,14500000,USD,14500000,"Y Combinator, SV Angel, Translink Capital, Tencent, Liquid 2 Ventures",1,14,2,"Adam Gibson, Chris Nicholson",251-500,"Artificial Intelligence (AI), Data and Analytics, Science and Engineering, Software",,,Active,For Profit,https://skymind.ai,https://www.twitter.com/skymindIO,https://www.facebook.com/Skymind-106964190806104/,https://www.linkedin.com/company/skymindinc/,"Skymind created Deeplearning4j, the open-source deep-learning framework for the JVM."
CareSkore,https://www.crunchbase.com/organization/careskore,"Analytics, Big Data, Consulting, Health Care, Information Technology, mHealth, Mobile, Predictive Analytics, SaaS, Software","Mountain View, California, United States",2014-09-07,day,4420000,USD,4420000,AI based Patient engagement 2.0,"66,670",,"61,662",2,2016-08-09,4300000,USD,4300000,4420000,USD,4420000,"Y Combinator, Liquid 2 Ventures, Cota Capital, Storm Ventures, Rising Tide",1,9,2,"Jas Grewal, Puneet Grewal",11-50,"Artificial Intelligence (AI), Data and Analytics, Health Care, Information Technology, Mobile, Professional Services, Software",,,Active,For Profit,http://www.careskore.com,https://twitter.com/@careskore,https://www.facebook.com/careskore,https://www.linkedin.com/company/care-skore,"CareSkore's web and mobile platform helps healthcare organizations better manage patient populations. Using multivariate predictive analysis, CareSkore helps better measure and manage clinical and financial risk on an ongoing basis. The solution helps reduce costs and optimize revenues. CareSkore comes complete with powerful features, robust reporting capabilities, automation, and is easy to use."
AdMobilize,https://www.crunchbase.com/organization/admobilize,"Ad Targeting, Advertising, Analytics, Artificial Intelligence (AI), Computer Vision, Digital Signage, Hardware, Internet of Things, Machine Learning, Software, Test and Measurement","Miami Lakes, Florida, United States",2014-01-01,year,8000000,USD,8000000,AdMobilize is a most trusted leader in audience intelligence for OOH & Retail.,"67,717",,"62,670",4,2018-04-01,,,,8000000,USD,8000000,"Fuel Venture Capital, Axel Springer, Rokk3r, VAS Ventures, Azoic Ventures",,5,2,"Brian Sanchez, Rodolfo Saccoman",11-50,"Advertising, Artificial Intelligence (AI), Data and Analytics, Hardware, Internet Services, Sales and Marketing, Science and Engineering, Software",,,Active,For Profit,https://www.admobilize.com,https://twitter.com/admobilize,http://www.facebook.com/AdMobilize,http://www.linkedin.com/company/admobilize,"AdMobilize, headquartered in Miami, FL with offices in London, UK, Bogota, Colombia, Sao Paulo, Brazil is a venture-backed AI company with seamless solutions for implementing advanced computer vision technologies in the brick and mortar world. The company has one clear mission; connecting the physical world to the online grid.  Our “drop in” solutions yield to each customer’s hardware/software needs.  AdMobilize’s suite of analytics and engagement products are designed to be ""Plug and Measure”, enabling real-time audience analytics and intelligence to be instantly activated at scale on any software/hardware platform.  AdMobilize offers the industry’s most complete and accurate analytics/engagement solution for digital signage, OOH, DOOH, retail, live events, small business, malls, restaurants, and beyond."
Agbotic,https://www.crunchbase.com/organization/agbotic,"Agriculture, Artificial Intelligence (AI), Food and Beverage","Sackets Harbor, New York, United States",2014-01-01,year,12080000,USD,12080000,Agbotic is deploys intelligent automation to make the world's best food on the world's most ecological farms.,"68,226",,"63,145",2,2019-06-20,7000000,USD,7000000,5080000,USD,5080000,NY Green Bank,1,1,1,John Gaus,11-50,"Agriculture and Farming, Artificial Intelligence (AI), Data and Analytics, Food and Beverage, Science and Engineering, Software",,,Active,For Profit,https://www.agbotic.com/,,,https://www.linkedin.com/company/agbotic-inc,"Agbotic deploys intelligent automation to make the world's best food on the world's most ecological farms. They are creating a network of robotic, organic farms that deliver premium food immediately from harvest. In the next decade, AI and automation will profoundly impact all industries. Agbotic is a thought leader for transformation in agriculture."
3TEN8,https://www.crunchbase.com/organization/3ten8,"Artificial Intelligence (AI), Data Center Automation, Machine Learning, Mobile, Predictive Analytics, Telecommunications, Virtualization, Wireless","San Jose, California, United States",2014-08-15,day,3670000,USD,3670000,3TEN8 is an artificial intelligence company for 5G network automation and operations.,"68,819",,"63,709",4,2018-12-18,,,,3670000,USD,3670000,"500 Global, Alchemist Accelerator, Social Capital, VU Venture Partners, Knockout Capital",2,13,3,"Elica Rahdar, Miro Salem, Naresh Guntupalli",1-10,"Artificial Intelligence (AI), Data and Analytics, Hardware, Information Technology, Mobile, Science and Engineering, Software",,,Active,For Profit,https://3ten8.com,https://www.twitter.com/3ten8,,https://www.linkedin.com/company/3ten8,"3TEN8 develops a cloud SaaS-based platform that helps mobile operators to understand and optimize their wireless networks and subscriber's experience. They creating cognitive operations technology (AIOps) for closed-loop, self-healing, and self-operating networks in 4G, 5G, and beyond. Its software provides insights and analytics for mobile carriers.  The company 's self-learning artificial intelligence technology predicts outages and network degradations and delivers self-healing actionable insights focused on preventing customer impact. Amr Salem, Naresh Guntupalli, and Elica Rahdar founded 3TEN8 on August 15, 2014. It has its headquarters in Santa Clara in California."
Tissue Analytics,https://www.crunchbase.com/organization/tissue-analytics,"Analytics, Artificial Intelligence (AI), Clinical Trials, Electronic Health Record (EHR), Health Care, Information Technology, mHealth, Real Time, Software","Baltimore, Maryland, United States",2014-01-01,year,7720000,USD,7720000,Securely stream patient photographs and wound analysis directly to your desktop!,"70,128",,"64,956",5,2018-01-16,5000000,USD,5000000,7720000,USD,7720000,"Tencent, Molnlycke Health Care, Penn Medicine, DigiTx Partners, Dreamit Ventures",3,8,3,"Gabriel Brat, Joshua Budman, Kevin Keenahan",1-10,"Artificial Intelligence (AI), Data and Analytics, Health Care, Information Technology, Mobile, Other, Science and Engineering, Software",,,Active,For Profit,https://www.tissue-analytics.com/,https://twitter.com/tissueanalytics,https://www.facebook.com/TissueAnalytics/,https://www.linkedin.com/company/tissue-analytics-inc-,"Securely stream patient photographs and wound analysis directly to your desktop! You can now objectively and automatically measure things like chronic wounds, burns, and skin conditions using only a smartphone. Nurses can stream photographs directly to your desktop, where you can evaluate, track, and manage your patients on Their secure web portal."
Evercontact,https://www.crunchbase.com/organization/evercontact,"Developer APIs, Email, Information Technology, Natural Language Processing, SaaS, Software","New York, New York, United States",2014-01-01,day,4500000,USD,4500000,"Evercontact turns email signatures into address book contacts, automatically adding new contacts for you and auto-updating existing ones.  ","70,840",,"65,632",5,2018-01-01,1000000,USD,1000000,3500000,USD,3500000,"AVP, Bleu Capital, Aurinvest, Florian Seroussi",1,4,2,"Florian Seroussi, G Rec",11-50,"Artificial Intelligence (AI), Data and Analytics, Information Technology, Internet Services, Messaging and Telecommunications, Software",,,Active,For Profit,https://www.evercontact.com,https://twitter.com/evercontact,https://www.facebook.com/Evercontact1,https://www.linkedin.com/company/one-more-company-inc/,Evercontact is an email software startup bringing natural language processing to email and contact management. Evercontact was launched in 2014 by a team of experienced developers and linguistic engineers. Evercontact was acquired by One More Company Inc in August 2016.
