Aira,https://www.crunchbase.com/organization/aira,"Assistive Technology, Augmented Reality, Computer Vision, Internet, Internet of Things, Social Impact, Software","La Jolla, California, United States",2014-01-01,year,35565000,USD,35565000,Aira provides tech-enabled services for the 300 million visually impaired people around the globe.,"25,991",,"23,498",6,2018-12-21,20000000,USD,20000000,35340000,USD,35340000,"National Science Foundation, Lux Capital, Felicis, Arboretum Ventures, ARCH Venture Partners",5,10,4,"Sujeeth Kanuganti, Suman Kanuganti, Watson Yim, Yuja Chang",51-100,"Hardware, Health Care, Internet Services, Other, Social Impact, Software",,,Active,For Profit,https://aira.io,https://twitter.com/airaio,https://www.facebook.com/aira.io,https://www.linkedin.com/company/airaio/,"Called a Godsend by The New York Times, Aira is on a mission to make the world accessible anywhere, anytime.  They provide on-remand, remote visual interpretation services for the blind and low vision community.  Download the app, press a button and your phone's camera streams a live video to one our highly screened Visual Interpreters."
VECTARY,https://www.crunchbase.com/organization/vectary,"3D Technology, Augmented Reality, Computer Vision, Graphic Design, Web Design","Redwood City, California, United States",2014-10-01,month,14648702,USD,14648702,"VECTARY is a design platform that specializes in the fields of augmented reality, computer vision, and 3D technology.","26,312",,"23,798",4,2023-01-25,4596479,USD,4596479,14648702,USD,14648702,"EQT Ventures, BlueYard Capital, Neulogy Ventures",2,3,2,"Michal Koor, Pavol Sovis",11-50,"Design, Hardware, Software",,,Active,For Profit,http://www.vectary.com,https://twitter.com/vectary,https://www.facebook.com/vectary3d,https://www.linkedin.com/company/vectary,"Build immersive experiences for the real world. Publish 3D and Augmented Reality content to any website on all platforms with Vectary Web AR and a fully-featured 3D design platform. It specializes in the fields of augmented reality, computer vision, and 3D technology. It was founded in 2014 and is headquartered in Redwood City, California."
Wallaroo,https://www.crunchbase.com/organization/sendence,"Artificial Intelligence (AI), Enterprise Software, Machine Learning, Real Time","New York, New York, United States",2014-01-01,year,31808685,USD,31808685,Wallaroo provides an enterprise AI platform that enables clients to deploy ML and analytics projects into production.,"26,975",,"24,411",5,2022-02-09,25000000,USD,25000000,31808685,USD,31808685,"Greycroft, Contour Venture Partners, boldstart ventures, RRE Ventures, Eniac Ventures",5,14,1,Vid Jain,11-50,"Artificial Intelligence (AI), Data and Analytics, Other, Science and Engineering, Software",,,Active,For Profit,http://www.wallaroo.ai,,,https://www.linkedin.com/company/5398024,"Wallaroo is a purpose-built platform for last-mile ML. It provides a simple, secure, and scalable deployment capability that fits an end-to-end workflow."
Paperspace,https://www.crunchbase.com/organization/paperspace,"Artificial Intelligence (AI), Cloud Computing, Enterprise Software, GPU, Machine Learning","New York, New York, United States",2014-06-01,day,34977998,USD,34977998,Paperspace powers next-generation applications built on GPUs.,"27,472",,"24,878",6,2021-05-24,12000000,USD,12000000,30499998,USD,30499998,"Y Combinator, Sorenson Capital, Amino Capital, Battery Ventures, Rocketship.vc",5,18,2,"Daniel Kobran, Dillon Erb",11-50,"Artificial Intelligence (AI), Data and Analytics, Hardware, Internet Services, Science and Engineering, Software",,,Active,For Profit,https://www.paperspace.com,https://twitter.com/hellopaperspace,https://www.facebook.com/HelloPaperspace,https://www.linkedin.com/company/paperspace,"Paperspace is a high-performance cloud computing and ML development platform for building, training and deploying machine learning models. Tens of thousands of individuals, startups and enterprises use Paperspace to iterate faster and collaborate on intelligent, real-time prediction engines."
Betterview,https://www.crunchbase.com/organization/betterview,"Computer Vision, Insurance, Predictive Analytics, Property Management, Risk Management","San Francisco, California, United States",2014-12-15,day,15550000,USD,15550000,"Betterview is a property intelligence platform that assists property insurers in analyzing, scoring, managing, and monitoring property risk.","28,239",,"25,588",11,2023-01-26,,,,15550000,USD,15550000,"Plug and Play, Alumni Ventures, 645 Ventures, 500 Global, Haystack",4,29,2,"Dave Tobias, David Lyman",51-100,"Artificial Intelligence (AI), Data and Analytics, Financial Services, Hardware, Professional Services, Real Estate, Software",,,Closed,For Profit,https://www.betterview.com,https://twitter.com/BetterV,https://www.facebook.com/BetterViewMarketplace,https://www.linkedin.com/company/betterview,"Betterview is a property intelligence platform that assists property insurers in analyzing, scoring, managing, and monitoring property risk.  Betterview improves the customer experience by accelerating decisions and improving risk at every point of the lifecycle. Betterview combines geospatial data sources, interprets them using proprietary ML technology, and converts the resulting insights into understandable and actionable insights."
Mighty AI,https://www.crunchbase.com/organization/spare5,"Artificial Intelligence (AI), Computer Vision, Machine Learning, Mobile, Software","Seattle, Washington, United States",2014-11-14,day,27250000,USD,27250000,Mighty AI delivers training data to companies that build computer vision models for autonomous vehicles.,"28,327",,"25,669",3,2017-01-10,14000000,USD,14000000,27250000,USD,27250000,"New Enterprise Associates, Madrona, Accenture, Foundry Group, Intel Capital",2,6,4,"Daryn Nakhuda, Matt Shobe, Matthew Bencke, Patrick O'Donnell",1-10,"Artificial Intelligence (AI), Data and Analytics, Hardware, Mobile, Science and Engineering, Software",,,Closed,For Profit,http://mty.ai,https://twitter.com/mighty_ai,https://www.facebook.com/mightyai/,https://www.linkedin.com/company/3753135,"Mighty AI delivers training data to companies that build computer vision models for autonomous vehicles. Its platform combines guaranteed accuracy with scale and expertise, thanks to its full stack of annotation software, consulting and managed services, proprietary machine learning, and global community of pre-qualified annotators. Founded in 2014, Mighty AI is headquartered in Seattle, Washington."
Protenus,https://www.crunchbase.com/organization/protenus,"Artificial Intelligence (AI), Big Data, Compliance, Health Care, Software","Baltimore, Maryland, United States",2014-01-01,year,57200000,USD,57200000,Protenus is a healthcare compliance analytics platform that brings artificial intelligence and automation to healthcare compliance.,"28,397",,"25,733",6,2021-06-15,21000000,USD,21000000,57200000,USD,57200000,"Gaingels, TEDCO, Transformation Capital, LionBird, F-Prime",5,14,2,"Nicholas Culbertson, Robert Lord",51-100,"Artificial Intelligence (AI), Data and Analytics, Health Care, Professional Services, Science and Engineering, Software",,,Closed,For Profit,https://www.protenus.com,https://twitter.com/protenus,https://www.facebook.com/protenusofficial,http://www.linkedin.com/company/protenus,"Protenus harnesses the power of AI to provide healthcare organizations with scalable risk-reduction solutions that drive the safest patient outcomes while protecting the reputation of the organizations. We are committed to innovation, determined to reduce risk, and focused on supporting our community of employees, customers, and ultimately, patients. Empowering healthcare to eliminate risk is at the heart of all we do. Founded in 2014, Protenus is a three-time winner of Forbes’ America’s Best Startup Employers, is a Great Place to Work®-Certified company, and was named one of 2021 CBInsights Digital Health 150, one of The Best Places to Work in Healthcare by Modern Healthcare, and one of the Best Places to Work in Baltimore by the Baltimore Business Journal and the Baltimore Sun. Learn more at Protenus.com and follow us on Twitter @Protenus."
Donde Search,https://www.crunchbase.com/organization/donde-search,"Artificial Intelligence (AI), Computer Vision, E-Commerce, E-Commerce Platforms, Natural Language Processing, Retail Technology, SaaS, Shopping, Software, Visual Search","New York, New York, United States",2014-03-17,day,10000000,USD,10000000,"Transforming the online shopping experience using AI, Computer Vision and NLP to develop Intuitive Visual Discovery for Retailers","29,330",,"26,589",3,2019-02-15,6500000,USD,6500000,10000000,USD,10000000,"Matrix, UpWest, Golden Seeds, AfterDox",2,4,2,"Liat Zakay, Shai Katzir",1-10,"Artificial Intelligence (AI), Commerce and Shopping, Data and Analytics, Hardware, Internet Services, Science and Engineering, Software",,,Active,For Profit,http://www.dondesearch.com,https://twitter.com/DondeSearch,https://www.facebook.com/DondeSearch,https://www.linkedin.com/company/dondesearch/,"Donde is transforming the online shopping experience by using its award winning AI, Computer Vision, and Natural Language Processing technology to help E-commerce sites mimic the way their customers think about products. By integrating Donde’s technology, retailers are able to react faster to trends, reduce operational overhead, shorten the purchase time and improve the user experience. Donde’s SaaS platform is being used by the biggest e-commerce companies in the world to provide intuitive visual discovery based on the product visual features - rather than words.   Based in NY and TLV with an amazing team, experts in Cloud and AI technology with deep expertise in Retail. The company is backed by a phenomenal network of advisors and investors such as Waze CEO, Mobileye's first investor, CNN founder and Ali Express Co-founder."
Yobe,https://www.crunchbase.com/organization/yobe-inc,"Artificial Intelligence (AI), Audio, Biometrics, Identity Management, Machine Learning","Boston, Massachusetts, United States",2014-05-15,day,5674588,USD,5674588,Yobe is a software company that develops artificial intelligence powered for the enhanced processing of communications signals.,"29,721",,"26,958",4,2022-11-08,3650000,USD,3650000,5450000,USD,5450000,"National Science Foundation, MaC Venture Capital, Azafran Capital Partners",3,3,2,"Hamid Nawab, Kenneth Sutton",1-10,"Artificial Intelligence (AI), Biotechnology, Data and Analytics, Information Technology, Media and Entertainment, Music and Audio, Privacy and Security, Science and Engineering, Software",,,Active,For Profit,https://yobeinc.com,https://twitter.com/yobeized,,https://www.linkedin.com/company/yobe-inc,"Yobe is a software company that develops artificial intelligence powered for the enhanced processing of communications signals. It uses artificial intelligence to identify unique voice biometrics within a noisy intake signal to identify and track individual voices. A byproduct of this capacity is that the signal of interest (the target person talking) can be enhanced for a better listening experience, and speaker identification, or enables significantly improved performance for automatic speech recognition (ASR)."
Dascena,https://www.crunchbase.com/organization/dascena,"Big Data, Biotechnology, Health Care, Machine Learning, Medical Device, Predictive Analytics","Houston, Texas, United States",2014-01-01,year,50449903,USD,50449903,Dascena develops machine learning algorithms to enable early disease intervention and improve care outcomes for patients.,"29,989",,"27,208",5,2022-03-29,,,,50000000,USD,50000000,"National Science Foundation, Frazier Healthcare Partners, National Institutes of Health, Longitude Capital, Euclidean Capital",4,6,1,Ritankar Das,51-100,"Artificial Intelligence (AI), Biotechnology, Data and Analytics, Health Care, Science and Engineering, Software",,,Active,For Profit,https://www.dascena.com,https://twitter.com/dascenainc,,https://www.linkedin.com/company/dascena,"Dascena develops machine learning algorithms to enable early disease intervention and improve care outcomes for patients. Dascena utilizes healthcare patient data to help detect disease, improve the delivery of care, and save lives. Dascena solves unmet healthcare needs in applications such as clinical decision support, point of care diagnostics, and biopharma companion diagnostics."
DarkLight,https://www.crunchbase.com/organization/champion-technology-company,"Artificial Intelligence (AI), Cyber Security, Network Security, Software","Redmond, Washington, United States",2014-01-01,year,8000000,USD,8000000,DarkLight develops cybersecurity AI software that fuses sensor data and client context.,"30,068",,"27,282",3,2019-02-01,4000000,USD,4000000,8000000,USD,8000000,"ECA Ventures, Fred Luddy, Dan Wachtler",,3,2,"John Shearer, Ryan Hohimer",1-10,"Artificial Intelligence (AI), Data and Analytics, Information Technology, Privacy and Security, Science and Engineering, Software",,,Active,For Profit,https://www.darklight.ai,https://twitter.com/DarkLightCyber,,https://www.linkedin.com/company/darklight,DarkLight develops cybersecurity AI software that fuses sensor data and client context. The company was founded to bridge the gaps and help organizations realize the full potential of AI.
LeapYear Technologies,https://www.crunchbase.com/organization/leapyear-technologies,"Analytics, Enterprise Software, Financial Services, Machine Learning, Privacy","San Francisco, California, United States",2014-12-09,day,53200000,USD,53200000,LeapYear develops technology for enterprises to securely unlock value from their most sensitive data assets.,"30,400",,"27,594",4,2021-09-30,15000000,USD,15000000,53200000,USD,53200000,"Lightspeed Venture Partners, Bain Capital Ventures, Nyca Partners, Dorm Room Fund, Harpoon",3,10,3,"Christopher Hockenbrocht, Colton Jang, Ishaan Nerurkar",51-100,"Artificial Intelligence (AI), Data and Analytics, Financial Services, Privacy and Security, Software",,,Closed,For Profit,https://leapyear.io/,https://twitter.com/leapyeartech,,https://www.linkedin.com/company/leapyear-technologies/,"LeapYear develops technology for enterprises to securely unlock value from their most sensitive data assets.  LeapYear’s platform implements differential privacy, a mathematically proven standard that enables data to be leveraged for machine learning, while ensuring that no data can be exposed or exploited. LeapYear has partnered with the largest companies across financial services, healthcare, technology, and insurance to combine, analyze, and monetize previously restricted and siloed sources of information."
TESTIM,https://www.crunchbase.com/organization/testim,"Artificial Intelligence (AI), Information Technology, Quality Assurance, SaaS, Software","San Francisco, California, United States",2014-09-01,month,25600000,USD,25600000,"Testim leverages machine learning for the authoring, execution and maintenance of automated tests.","30,566",,"27,755",5,2021-11-01,10000000,USD,10000000,25600000,USD,25600000,"Lightspeed Venture Partners, SignalFire, Heavybit, Meron Capital, TSVC",4,8,1,Oren Rubin,101-250,"Artificial Intelligence (AI), Data and Analytics, Information Technology, Professional Services, Science and Engineering, Software",,,Active,For Profit,https://testim.io/,https://twitter.com/testim_io,https://www.facebook.com/testimdotio,https://www.linkedin.com/company/testim-io,"Testim makes it easy for developers and testers to become automation experts, making quality an organization-wide initiative and powering developers to own code quality."
Pyze,https://www.crunchbase.com/organization/pyze,"Analytics, Artificial Intelligence (AI), CRM, Information Technology, Internet, Machine Learning, Marketing Automation, Mobile, Predictive Analytics, SaaS","Redwood City, California, United States",2014-01-01,year,6300000,USD,6300000,"Pyze enables AI-Driven process improvement by automating bottleneck detection, identifying hotspots, & maximizing business results.","30,688",,"27,867",3,2019-07-24,4600000,USD,4600000,6300000,USD,6300000,"Illuminate Ventures, Correlation Ventures, Benhamou Global Ventures, AAF Management Ltd., Mentors Fund",1,10,3,"Dickey Singh, John Chisholm, Prabhjot Singh",11-50,"Artificial Intelligence (AI), Data and Analytics, Information Technology, Internet Services, Mobile, Sales and Marketing, Science and Engineering, Software",,,Active,For Profit,http://pyze.com,http://twitter.com/pyzeInc,http://www.facebook.com/PyzeInc,https://www.linkedin.com/company/3574122/,"Pyze helps enterprises continuously improve business operations by analyzing processes across different complex architectures in near real-time with it's AI-Driven Process Intelligence Platform. Pyze automates bottleneck detection, identifies hotspots, & maximizes business results. Proven success to enable digital transformation at large clients who have challenges managing significant transaction volume and process complexity across multi-platform architectures. Enabled aggressive digital transformation goals with proven results like.  - 70% reduction in costs - 50% faster processing times - 25% increase in employee productivity Pyze partners with low code, BPM, and RPA platforms like Pega, Appian, OutSystems, and Salesforce Lighting to provide solutions to prioritize migration of legacy applications and optimize business processes efficiency. Pyze has been recognized by leading technology research firms (Gartner and Forrester) and the press as a leader in cross-platform analytics and user engagement."
Pendulum Systems,https://www.crunchbase.com/organization/pendulumsystems,"Artificial Intelligence (AI), Machine Learning, Scheduling, Software, Supply Chain Management","Washington, District of Columbia, United States",2014-01-01,year,11000000,USD,11000000,Pendulum Systems is an AI company that specializes in embedded software and builds agnostic solutions for geolocation.,"30,890",,"28,050",1,2022-05-26,11000000,USD,11000000,11000000,USD,11000000,"Decisive Point, Lowercarbon Capital, Massachusetts Institute of Technology, Newlab, Collaborative Fund",,8,3,"Benjamin Fels, Drew Arenth, MBA, Suvrit Sra",11-50,"Artificial Intelligence (AI), Data and Analytics, Information Technology, Science and Engineering, Software, Transportation",,,Active,For Profit,https://www.pendulum.global/,https://twitter.com/pendulumsystems,,https://www.linkedin.com/company/pendulumglobal/ ,"Pendulum Systems is an AI company that builds software with agnostic solutions for geolocation. It runs on a device and requires no new hardware, connectivity, or access to GPS. It is built to protect the warfighter. It specializes in machine learning, artificial intelligence, geolocation, and embedded software."
GroupSense,https://www.crunchbase.com/organization/groupsense,"Artificial Intelligence (AI), Cyber Security, Information Technology, Network Security, Risk Management, Security","Arlington, Virginia, United States",2014-06-01,day,1851492,USD,1851492,"GroupSense is a provider of cyber intelligence services filled with search tools, feeds, and briefings.","31,034",,"28,183",4,2024-03-25,449995,USD,449995,1851492,USD,1851492,"Invictus Growth Partners, IrishAngels, New Dominion Angels, Three Tree Ventures",,4,,,11-50,"Artificial Intelligence (AI), Data and Analytics, Information Technology, Privacy and Security, Professional Services, Science and Engineering, Software",,,Active,For Profit,http://groupsense.io,http://twitter.com/groupsensecyber,https://www.facebook.com/groupsense/,https://www.linkedin.com/company/groupsense/,"GroupSense is a provider of cyber intelligence services filled with search tools, feeds, and briefings. It is difficult to measure the value and sift through the noise. GroupSense offers a unique partnership based approach to an intelligence program tailored to your mission. Our Cyber Reconnaissance solution is a combination of highly scalable technology and experienced intelligence analysts, providing only meaningful, high-fidelity intelligence data. Groupsense is changing the way cyber intelligence is delivered and operationalized across mid- to large-sized enterprises and governments. Their Recon Services provide critical action oriented data that helps protect the world's largest networks, critical intellectual property, and election integrity."
LeanDNA,https://www.crunchbase.com/organization/leandna,"Analytics, Artificial Intelligence (AI), Industrial Manufacturing, Information Technology, Manufacturing, SaaS, Software, Supply Chain Management","Austin, Texas, United States",2014-01-01,year,19500000,USD,19500000,"LeanDNA is an inventory optimization solution for manufacturers that ensures on-time delivery, reduces inventory waste & prevents shortages.","31,356",,"28,476",2,2019-12-11,15000000,USD,15000000,19500000,USD,19500000,"Next Coast Ventures, S3 Ventures, Ronyp Kahan",2,3,1,Richard Lebovitz,51-100,"Artificial Intelligence (AI), Data and Analytics, Information Technology, Manufacturing, Science and Engineering, Software, Transportation",,,Active,For Profit,https://www.leandna.com,,https://www.facebook.com/leandna,https://www.linkedin.com/company/leandna,"LeanDNA software enables discrete manufacturers to predictively balance supply and demand by synchronizing procurement and production to ensure on-time delivery, reduce inventory waste, and prevent shortages."
Pachyderm,https://www.crunchbase.com/organization/pachyderm,"Analytics, Artificial Intelligence (AI), Big Data, Developer APIs, Machine Learning, Open Source, SaaS","San Francisco, California, United States",2014-01-01,year,28120000,USD,28120000,"Pachyderm is an enterprise-grade data science platform that makes explainable, repeatable, and scalable AI/ML a reality.","31,394",,"28,513",4,2020-08-19,16000000,USD,16000000,28120000,USD,28120000,"Y Combinator, Foundation Capital, Caffeinated Capital, Benchmark, DCVC",2,15,2,"Joe Doliner, Joey Zwicker",51-100,"Artificial Intelligence (AI), Data and Analytics, Science and Engineering, Software",,,Active,For Profit,https://www.pachyderm.com,https://twitter.com/pachyderminc,https://www.facebook.com/pachydermIO,https://www.linkedin.com/company/pachyderm-inc-,"Pachyderm is an enterprise-grade, open-source data science platform that makes explainable, repeatable, and scalable ML/AI a reality. Its platform brings together version control for data with the tools to build scalable end-to-end ML/AI pipelines while empowering users to use any language, framework, or tool ."
Carbon Robotics,https://www.crunchbase.com/organization/katia,"Computer Vision, Consumer Electronics, Hardware, Robotics","San Francisco, California, United States",2014-07-15,day,30360354,USD,30360354,Carbon Robotics makes advanced robotics dramatically more accessible to help solve some of society's most intractable problems.,"31,970",,"29,052",5,2021-09-01,27000000,USD,27000000,30360354,USD,30360354,"Techstars, SOSV, HAX, Duke Angel Network, Qualcomm Robotics Accelerator",1,5,2,"Dan Corkum, Rosanna Myers",11-50,"Consumer Electronics, Hardware, Science and Engineering, Software",,,Closed,For Profit,http://www.carbon.ai,https://twitter.com/carbonrobotics,https://www.facebook.com/carbonrobotics/,https://www.linkedin.com/company/carbon-robotics,"Carbon Robotics makes advanced robotics dramatically more accessible to help solve some of society's most intractable problems. Carbon Robotics is bringing advanced robotics to the masses. One of the Top 50 ""most influential public & private companies in the global robotics industry"" by the Robotics Business Review in 2016."
Looking Glass Factory,https://www.crunchbase.com/organization/looking-glass,"3D Technology, Augmented Reality, Digital Media, Human Computer Interaction","Brooklyn, New York, United States",2014-01-01,year,21144621,USD,21144621,"Looking Glass Factory is building the holographic future, starting with the Looking Glass, the world's best selling holographic display.","31,991",,"29,073",8,2023-02-07,,,,20300000,USD,20300000,"Alumni Ventures, Lux Capital, Uncork Capital, SOSV, Foundry Group",3,11,2,"Alex Hornstein, Shawn Frayne",11-50,"Design, Hardware, Media and Entertainment, Science and Engineering, Software",,,Active,For Profit,https://lookingglassfactory.com/,https://twitter.com/lkgglass,https://www.facebook.com/lookingglassfactory/,https://www.linkedin.com/company/looking-glass-factory/,"Looking Glass Factory is building the holographic future, starting with the Looking Glass, the world’s first desktop holographic display for 3D creators—no VR or AR headset required. The company was founded in 2015 and is headquartered in Brooklyn, New York with a wholly-owned subsidiary in Hong Kong."
