name,description,short_description,founded_year,funding_total_usd,funding_stage,founders,investors,categories,city,region,country,ai_focus,sector,website,linkedin_url,crunchbase_url,source_url,extraction_date
GenesisAI,GenesisAI is an Artificial Intelligence marketplace that allows companies to buy or sell AI products and services at scale.,Genesis AI develops AI models for robots using synthetic data.,2021.0,55055000.0,series_a,Zhou Xian|Théophile Gervet|Archil Cheishvili,Netcapital|Cfv Ventures|Startfast Ventures|Queen City Fintech|Equity Crowdfunding,AI|Robotics,,,,"Genesis AI focuses on developing a foundational model that enables robots to automate a variety of repetitive tasks, leveraging synthetic data generated from a proprietary physics engine to enhance learning and performance.",ai_robotics,https://www.genesisai.io/,https://www.linkedin.com/company/genesisai/,https://www.crunchbase.com/organization/genesisai,https://techcrunch.com/2025/07/01/genesis-ai-launches-with-105m-seed-funding-from-eclipse-khosla-to-build-ai-models-for-robots/,2025-07-14 08:28:32.879931
EdgeRunner AI,EdgeRunner AI is a technology company.,Generative AI platform for defense and regulated enterprises.,2024.0,11500000.0,series_a,Colton Malkerson|Tyler Saltsman,Alumni Ventures|Madrona|Four Rivers Group|Hp Tech Ventures,AI|Business/Productivity Software,Seattle,WA,USA,"EdgeRunner AI specializes in developing generative AI platforms tailored for the defense community and regulated enterprises, focusing on on-device AI agents that prioritize data privacy and security while enhancing operational efficiency.",ai_defense,https://www.edgerunnerai.com/,https://www.linkedin.com/company/edgerunner-ai,https://www.crunchbase.com/organization/edgerunner-ai,https://pitchbook.com/profiles/company/608962-15,2025-07-14 08:28:46.525966
Exa,Exa is an AI research center that is reinventing the quest for AI.,A startup creating a search engine specifically for AI models.,2021,19500000.0,series_a,Will Bryk|Jeffrey Wang,Y Combinator|Lightspeed Venture Partners|Nventures|Mei Z.,AI|Machine Learning,,,,"Exa is focused on enhancing web search capabilities through AI by predicting links instead of relying solely on keyword searches, which is a novel approach in natural language processing.",ai_nlp,https://exa.ai,https://www.linkedin.com/company/exa-ai/,https://www.crunchbase.com/organization/exa-1b30,https://techcrunch.com/2024/07/16/exa-raises-17m-lightspeed-nvidia-ycombinator-google-ai-models/,2025-07-14 08:28:53.676987
Alta,Alta leverages data and AI to drive business growth 24/7.,Alta is an AI-driven personal styling agent that helps users choose outfits.,2023.5,9000000.0,seed,Jenny Wang|Mor Shabtai|Stav Neumark|Tom Hoffen,Entrée Capital|Target Global|Ben Lang,AI|Fashion Tech,,,,"Alta utilizes computer vision to analyze user preferences and provide personalized outfit recommendations based on various factors such as budget, lifestyle, weather, and calendar events. The application of AI allows users to visualize how outfits will look on them through virtual avatars.",ai_fashion,https://www.altahq.com/,https://www.linkedin.com/company/altahqdotcom/about/,https://www.crunchbase.com/organization/alta-eab5,https://techcrunch.com/2025/06/16/alta-raises-11m-to-bring-clueless-fashion-tech-to-life-with-all-star-investors/?utm_source=chatgpt.com,2025-07-14 08:29:01.572626
Reflection.Ai,"Reflection.Ai is a start-up that develops artificial intelligence solutions, with a focus on computer vision.",A startup focused on creating AI agents for automating knowledge work.,2024.0,115000000.0,series_a,Misha Laskin|Ioannis Antonoglou,Sequoia Capital|Lightspeed Venture Partners|Sv Angel|Crv|Nventures,AI|Machine Learning,,,,"Reflection AI is focused on developing general AI agents that can automate various knowledge work tasks performed on computers, enhancing productivity and efficiency.",ai_general,https://www.reflection.ai,https://www.linkedin.com/company/reflection-ai,https://www.crunchbase.com/organization/reflection-ai,https://www.businessinsider.com/sequoia-invests-reflection-ai-startup-vc-2024-8,2025-07-14 08:29:36.441011
Palona AI,Palona AI offers a range of artificial intelligence technologies that boost D2C growth.,Palona AI develops AI technologies for direct-to-consumer growth.,2024,10000000.0,seed,Maria Zhang,Fusion Fund|Uphonest Capital|Neo Investment Partners|Maynard Webb,AI,Palo Alto,California,United States,"Palona AI specializes in providing a variety of artificial intelligence technologies aimed at enhancing direct-to-consumer (D2C) business growth, focusing on general AI applications that can be utilized across different industries.",ai_general,https://palona.ai/,https://www.linkedin.com/company/proactive-ai-lab/about/,https://www.crunchbase.com/organization/palona-ai,https://www.crunchbase.com/organization/palona-ai,2025-07-14 08:29:44.838869
Goodfire,AI interpretability research company,Goodfire aims to enhance the transparency of generative AI models through innovative interpretability tools.,2024.0,32000000.0,series_a,Eric Ho|Dan Balsam|Tom Mcgrath,Anthropic|Menlo Ventures|South Park Commons|Lightspeed Venture Partners|B Capital,AI|Machine Learning,,,,"Goodfire is focused on enhancing the understanding and manipulation of generative AI models through tools that improve mechanistic interpretability, allowing users to observe and edit model behavior effectively.",ai_tools,https://goodfire.ai/,https://www.linkedin.com/company/goodfire-ai/,https://www.crunchbase.com/organization/goodfire-b4cb,https://venturebeat.com/ai/goodfire-raises-7m-for-its-brain-surgery-like-ai-observability-platform/,2025-07-14 08:30:05.260664
Physical Intelligence,Physical Intelligence is an AI company developing machine learning for robots and other physical devices.,An AI startup focused on developing algorithms for robotics.,2024.0,435000000.0,series_a,Adnan Esmail|Brian Ichter|Karol Hausman|Lachy Groom|Quan Vuong,Openai|Khosla Ventures|Sequoia Capital|Bond|Thrive Capital,AI|Robotics,,,,"Physical Intelligence focuses on developing AI models and algorithms that enable robots to perform tasks in real-world environments, enhancing their adaptability and functionality.",ai_robotics,https://physicalintelligence.company,https://www.linkedin.com/company/physical-intelligence,https://www.crunchbase.com/organization/physical-intelligence-834b,https://www.inc.com/brian-contreras/this-robotics-ai-brain-startup-just-raised-400-million-from-jeff-bezos-openai-and-others/90998896,2025-07-14 08:30:14.467275
Haize Labs,Haize Labs creates artificial intelligence-based development tools that automate massive language model stress testing at scale.,Haize Labs builds algorithms to test vulnerabilities in AI systems.,2023,,seed,Leonard Tang|Steve Li,General Catalyst|Pear Vc|Stage 2 Capital|Sara Du|Beyond Capital,AI Safety|Generative AI,,,,"Haize Labs is focused on developing automated solutions to identify and test vulnerabilities in generative AI systems, particularly large language models and AI agents, which is critical for ensuring the security and reliability of AI applications.",ai_security,https://haizelabs.com,https://www.linkedin.com/company/haizelabs,https://www.crunchbase.com/organization/haize-labs,https://www.businessinsider.com/vc-clamor-invest-ai-safety-startup-haize-labs-2024-6?utm_campaign=tech-sf&utm_source=twitter&utm_medium=social,2025-07-14 08:30:24.868661
Aragon.ai,Aragon.ai is an AI photography company,AI photography company specializing in generating headshots.,2023.0,,pre_seed,Akhil Na|Wesley Tian,Neo,AI|Photography,San Francisco,California,United States,"Aragon.ai utilizes computer vision techniques to generate high-quality headshots using artificial intelligence, enabling users to obtain professional images quickly and affordably.",ai_photography,https://aragon.ai/,https://www.linkedin.com/company/aragonai/,https://www.crunchbase.com/organization/aragon-ai,https://www.crunchbase.com/organization/aragon-ai,2025-07-14 08:30:48.218693
World Labs,World Labs develops AI models with spatial intelligence for 3D world perception and interaction.,A startup aiming to advance AI's visual data processing and reasoning capabilities.,2024.0,165000000.0,series_unknown,Fei-Fei Li|Ben Mildenhall|Christoph Lassner|Fei Fei Li|Justin Johnson,Andreessen Horowitz|New Enterprise Associates|Radical Ventures|Salesforce Ventures|Sound Ventures,AI|Computer Vision,,,,"World Labs is focused on enhancing AI's reasoning capabilities through the development of human-like processing of visual data, particularly in understanding three-dimensional physical environments.",ai_computer_vision,https://www.worldlabs.ai,https://www.linkedin.com/company/world-labs,https://www.crunchbase.com/organization/world-labs,https://www.theverge.com/2024/7/17/24200496/ai-fei-fei-li-world-labs-andreessen-horowitz-radical-ventures,2025-07-14 08:30:54.805561
Trieve,"Trieve is the modern API for search, recommendations, and RAG at scale",Trieve provides an API for search and recommendations.,2023,3750000.0,seed,Denzell Ford|Nicholas Khami,Y Combinator|Root Ventures|Soma Capital|Kulveer Taggar|Transpose Platform Management,AI|ML,San Francisco,California,United States,"Trieve specializes in leveraging natural language processing (NLP) to enhance search capabilities, provide personalized recommendations, and facilitate retrieval-augmented generation (RAG) at scale.",ai_search,https://trieve.ai,https://www.linkedin.com/company/trieveai,https://www.crunchbase.com/organization/trieve,https://www.crunchbase.com/organization/trieve,2025-07-14 08:31:09.231966
Firecrawl,Firecrawl is an API service designed to transform URLs into clean markdown or structured data for easy integration with LLMs.,A web-crawling tool for scraping data from websites for LLMs.,2022,1000000.0,pre_seed,Caleb Peffer|Eric Ciarla|Nicolas Camara,,AI|Web Crawling|Data Scraping,,,,"Firecrawl provides a web-crawling tool that scrapes data from websites specifically for large language models (LLMs), focusing on enhancing the quality and safety of data used in AI applications.",ai_nlp,https://www.firecrawl.dev,https://www.linkedin.com/company/firecrawl,https://www.crunchbase.com/organization/firecrawl,https://techcrunch.com/2025/05/17/y-combinator-startup-firecrawl-is-ready-to-pay-1m-to-hire-three-ai-agents-as-employees/,2025-07-14 08:31:16.648272
Alecto AI,"Alecto AI offers facial recognition technology for identity verification, access control, and combating online image abuse.",Alecto AI offers AI-driven solutions for enterprise security and privacy.,2024,,,Wen Liu|Qi Xia|Breeze Liu,,SaaS|Enterprise Security|Privacy|AI|Machine Learning,,,,"Alecto AI utilizes AI and machine learning technologies to enhance security measures and privacy protocols for enterprises, providing intelligent solutions that adapt to emerging threats.",ai_enterprise_security,https://alectoai.com,https://www.linkedin.com/company/alectoai,https://www.crunchbase.com/organization/alecto-ai,https://techcrunch.com/startup-battlefield/company/alecto-ai/,2025-07-14 08:31:30.272043
Allie Systems,AI for Discrete and Hybrid Manufacturing,Allie Systems leverages AI to improve factory operations.,2022,2300000.0,pre_seed,Alex Sandoval|Nicolas DeGiorgis|Andrés Naranjo|Ernesto Hermosillo|Nicolás Degiorgis,Caravela Capital|0Bs,Analytics|Big Data|AI/Machine Learning|Industrial Manufacturing,,,,"Allie Systems utilizes analytics and AI/Machine Learning to optimize and enhance manufacturing processes on factory floors, focusing on improving efficiency and productivity.",ai_manufacturing,https://alliesystem.com/,,https://www.crunchbase.com/organization/allie-systems-be1c,https://techcrunch.com/startup-battlefield/company/allie-ai,2025-07-14 08:31:36.823388
Nexa AI,Nexa AI is a software development company that offers an app development platform for users to build apps based on AI models and tools.,Nexa AI develops AI solutions for security and privacy.,2023.5,,seed,Alex Chen|Zack Li,Plug And Play|Alumni Ventures,Security & Privacy|AI/Machine Learning|Dev Tools,,,,"Nexa AI focuses on leveraging artificial intelligence and machine learning technologies to enhance security measures and protect user privacy, while also providing tools for developers to integrate these solutions.",ai_security,https://nexa.ai/,https://www.linkedin.com/company/nexa-ai/,https://www.crunchbase.com/organization/nexa-ai,https://techcrunch.com/startup-battlefield/company/nexa-ai/,2025-07-14 08:31:44.265891
Cloneable,"Cloneable uses AI to make data collection from drones and robots faster and easier, so businesses can make better decisions.",A SaaS platform for AI and machine learning development tools.,2022,750000.0,pre_seed,Lia Reich|Pat Lohman|Tyler Collins,,SaaS|AI|Machine Learning|Dev Tools|Deep tech,,,,Artificial Intelligence,machine_learning,https://cloneable.ai,,https://www.crunchbase.com/organization/cloneable,https://techcrunch.com/startup-battlefield/company/cloneable-ai/,2025-07-14 08:31:52.369120
Sakana AI,"Sakana AI is an IT firm that develops an AI-based model to generate text, images, video, code, and multimedia.",Sakana AI is an AI research lab pushing the boundaries of AI innovation.,2023,230000000.0,series_a,David Ha|Llion Jones|Ren Ito,Khosla Ventures|Nvidia|New Enterprise Associates|Geodesic Capital|Lux Capital,AI|Machine Learning,,,,"Sakana AI is focused on exploring alternative approaches to foundation models, emphasizing adaptability and resilience in AI systems.",ai_research,https://sakana.ai,https://www.linkedin.com/company/sakana-ai,https://www.crunchbase.com/organization/sakana-ai,https://500.co/content/sakana-ai-investing-in-global-pioneers-in-ai,2025-07-14 08:32:02.431255
Galen Data,Galen Data is a Technology Company.,Galen AI builds autonomous AI agents.,2020.0,2861172.5,series_unknown,Priyanka Shrestha|Abbas Dhilawala|Alex Condon|Chris Dupont,Texas Halo Fund|Houston Angel Network,AI|agentic AI,San Francisco,California,USA,"Galen AI develops solutions that enable AI systems to think and perform tasks autonomously, focusing on creating agentic AI that can operate independently.",ai_general,http://www.galendata.com,https://www.linkedin.com/company/galenai,https://www.crunchbase.com/organization/galen-data,https://www.businessinsider.com/y-combinator-yc-demo-day-spring-ai-agent-startups-2025-6,2025-07-14 08:32:18.295023
Play AI,Play AI operates as a modular chain for AI in gaming.,A startup focused on AI-generated human voices.,2023,5100000.0,seed,,Polygon Ventures|Mh Ventures|Alphawave Group|Jump Crypto|Tykhe Ventures,AI|Voice Generation,,,,"Play AI focuses on natural language processing (NLP) to create AI-generated human-like voices, enabling users to easily generate voice content.",ai_nlp,https://playai.network/,https://www.linkedin.com/company/playainetwork/,https://www.crunchbase.com/organization/play-ai,https://techcrunch.com/2025/07/13/meta-acquires-voice-startup-play-ai/,2025-07-14 08:32:31.403859
Windsurf,Windsurf provides an AI coding assistant and integrated development environment for developers.,Windsurf is an AI coding startup focused on helping programmers with code generation.,2022.5,243000000.0,series_c,Varun Mohan|Douglas Chen,General Catalyst|Founders Fund|Kleiner Perkins|Greenoaks|Nitesh Banta,AI|coding|generative AI,,,,"Windsurf utilizes generative AI to assist programmers in writing code, enhancing productivity and reducing errors in the coding process.",ai_software_development,https://windsurf.com,https://www.linkedin.com/company/windsurf,https://www.crunchbase.com/organization/codeium,https://fortune.com/2025/07/11/the-exclusivity-on-openais-3-billion-acquisition-for-coding-startup-windsfurf-has-expired/,2025-07-14 08:32:41.186298
Pollen Robotics,Pollen Robotics develops humanoid service robots specialized in the interaction and manipulation of objects.,Pollen Robotics creates accessible robotic solutions for developers.,2020.0,2702885.0,series_unknown,Jonathan Grizou|Matthieu Lapeyre|Nicolas Rabault|Pierre Rouanet,Bpifrance|Societe Generale|Easme|Bnp Paribas Private Equity,robotics|AI,,,,"Pollen Robotics focuses on enhancing accessibility and usability in robotics, leveraging AI to create innovative solutions that simplify robotic development for businesses and developers.",ai_robotics,http://pollen-robotics.com/,https://www.linkedin.com/company/pollen-robotics/,https://www.crunchbase.com/organization/pollen-robotics,https://venturebeat.com/ai/hugging-face-just-launched-a-299-robot-that-could-disrupt-the-entire-robotics-industry/?utm_source=tldrnewsletter,2025-07-14 08:32:49.489850
Factory,Factory specializes in creating an AI-driven platform designed to streamline computer coding and software engineering processes.,Factory automates engineering tasks using AI technology.,2023,20000000.0,series_a,Matan Grinberg|Eno Reyes,Sequoia Capital|Boxgroup|Lux Capital|Sv Angel|Abstract,AI|Software Engineering,San Francisco,California,United States,"Factory utilizes AI to automate coding tasks, enhancing software development efficiency through systems known as Droids that assist in generating features, reviewing code, and resolving bugs.",ai_software_development,https://www.factory.ai/,https://www.linkedin.com/company/factory-hq/,https://www.crunchbase.com/organization/factory-19d8,https://www.bloomberg.com/news/articles/2024-06-18/sequoia-backs-ai-startup-that-automates-engineering-tasks,2025-07-14 08:33:04.891985
Mach Industries,Mach Industries is a defense manufacturing company that develops unmanned systems and defense infrastructure.,Mach Industries develops innovative defense technologies and aims to build decentralized factories for manufacturing.,2023.5,186699992.0,series_b,Ethan Thornton,Sequoia Capital|Khosla Ventures|Signalrank|Dcvc|Bedrock,Defense Tech,Huntington Beach,California,United States,N/A,defense_technology,https://www.machindustries.com,https://www.linkedin.com/company/machindustries,https://www.crunchbase.com/organization/mach-industries,https://techcrunch.com/2025/03/04/mach-industries-founded-by-21-year-old-ethan-thornton-lands-us-army-contract-builds-weapons-factory/?utm_source=openai,2025-07-14 08:33:11.715471
Archetype AI,Archetype AI is a group of designers and technologists.,A startup that connects chatbots to real-world data through sensor interpretation.,2023.5,13000000.0,seed,Ivan Poupyrev,Plug And Play|Venrock|Hitachi Ventures|Buckley Ventures|5G Open Innovation Lab,AI|Machine Learning,,,,"Archetype AI focuses on natural language processing (NLP) to enable chatbots to interpret and respond to real-world data derived from billions of sensors, providing actionable insights about physical reality.",ai_general,https://www.archetypeai.io,,https://www.crunchbase.com/organization/archetype-ai,https://www.wired.com/story/plaintext-ai-startup-archetype-talk-to-houses-cars-and-factories/,2025-07-14 08:33:38.299468
EnCharge AI,EnCharge AI designs analog in-memory-computing AI chips and develops AI systems for AI computing.,EnCharge AI creates efficient AI chips for edge computing.,2022,131450000.0,series_b,Naveen Verma|Echere Iroaga|Kailash Gopalakrishnan,Alumni Ventures|Scout Ventures|Vanderbilt University|Alleycorp|Tiger Global Management,AI|Semiconductors,,,,"EnCharge AI specializes in developing analog chips that enhance AI inference capabilities specifically for edge computing devices, enabling efficient processing of AI tasks at the device level.",ai_hardware,https://enchargeai.com,https://www.linkedin.com/company/encharge-ai,https://www.crunchbase.com/organization/encharge-ai,https://www.reuters.com/technology/artificial-intelligence/encharge-ai-raises-over-100-million-funding-bring-ai-inference-chips-market-2025-02-13/,2025-07-14 08:34:10.340715
Perplexity,"Perplexity is an AI-powered answer engine designed to provide accurate, real-time responses to user queries.",Perplexity AI develops an AI-driven web browser called Comet.,2023.0,1175000000.0,series_unknown,Andy Konwinski|Aravind Srinivas|Denis Yarats|Johnny Ho,Accel|Nvidia|Bessemer Venture Partners|Ivp|New Enterprise Associates,AI|Web Browsers,,,,"Perplexity AI focuses on natural language processing (NLP) to enhance search capabilities within its web browser, Comet, allowing it to act as an intelligent agent that can understand and respond to user queries in a more human-like manner.",ai_software,https://www.perplexity.ai,https://www.linkedin.com/company/perplexity-ai,https://www.crunchbase.com/organization/perplexity-ai,https://www.reuters.com/business/media-telecom/nvidia-backed-perplexity-launches-ai-powered-browser-take-google-chrome-2025-07-09/,2025-07-14 08:34:21.270997
DeepSeek,DeepSeek is an artificial intelligence software company that focuses on developing open-source large language models (LLMs).,DeepSeek is an AI startup focused on developing advanced AI models that require less powerful hardware.,2023,,,Liang Wenfeng,,AI|Machine Learning,,,China,"DeepSeek has developed an AI model, R1, that enhances reasoning capabilities while being operable on less advanced chips, indicating a focus on making AI more accessible and efficient in natural language processing tasks.",ai_nlp,https://www.deepseek.com,https://www.linkedin.com/company/deepseek-ai,https://www.crunchbase.com/organization/deepseek,https://fortune.com/2025/01/27/deepseek-chinese-ai-startup-nvidia-ai/,2025-07-14 08:34:32.050969
Hearth.AI,Hearth.AI is an artificial intelligence platform designed to deliver semantic network searches.,AI platform for semantic network searches.,2021,,seed,Ashe Magalhaes,Pear Vc|Salesforce Ventures,AI|Machine Learning,New York,New York,United States,"Hearth.AI specializes in semantic network searches, utilizing artificial intelligence to enhance search capabilities by understanding the context and meaning behind queries.",ai_search,https://hearth.ai/,https://www.linkedin.com/company/hearth-ai,https://www.crunchbase.com/organization/hearth-ai-f5a6,https://www.crunchbase.com/organization/hearth-ai-f5a6,2025-07-14 08:35:02.074238
Anakin AI,"Create your own AI app in ONE minute. Our no-code AI app builder lets you create unique, standalone AI Apps that automate tasks, and more!",Create your own AI app in ONE minute with Anakin AI's no-code platform.,2023.5,,,,,AI|No-code,San Francisco,California,United States,"Anakin AI focuses on enabling users to create unique, standalone AI applications without the need for coding, primarily aimed at automating various tasks.",ai_general,https://anakin.ai/,https://www.linkedin.com/company/anakin-ai/,https://www.crunchbase.com/organization/anakin-ai,https://www.crunchbase.com/organization/anakin-ai,2025-07-14 08:35:11.943303
Newo.ai,"Newo Inc. is the creator of the drag-n-drop builder of the Non-Human Workers, Digital Employees, Intelligent Agents",Newo Inc. develops a platform for creating digital employees and intelligent agents.,2023.5,5854509.0,seed,David Yang,,AI|Automation,San Francisco,California,United States,"Newo Inc. specializes in creating intelligent agents that function as digital employees, utilizing a drag-and-drop builder to facilitate the development and deployment of non-human workers.",ai_intelligent_agents,https://newo.ai/,https://www.linkedin.com/company/newo-ai,https://www.crunchbase.com/organization/newo-ai,https://www.crunchbase.com/organization/newo-ai,2025-07-14 08:35:26.954227
Voker,"Voker is a no-code platform for product teams to build AI features quickly, boosting customer experience and retention.",A no-code platform for building AI features.,2024,,,,,B2B|SaaS|Software,San Francisco,California,United States,"Voker enables product teams to integrate AI features into their products without the need for coding, thereby enhancing customer experience and retention.",ai_technology,https://voker.ai/,https://www.linkedin.com/company/voker-ai/,https://www.crunchbase.com/organization/voker-60d8,https://www.crunchbase.com/organization/voker-60d8,2025-07-14 08:35:35.266705
Practicus AI,"Infinite Possibilities, One AI Platform",An AI platform aimed at alleviating workload for attorneys.,2022.0,,seed,Hakan Eren,,AI|LegalTech,Seattle,Washington,United States,"Practicus AI utilizes natural language processing (NLP) to automate legal tasks, streamline workflows, and reduce the workload and burnout experienced by legal professionals.",ai_legaltech,https://practicus.ai,https://www.linkedin.com/company/practicus-ai/,https://www.crunchbase.com/organization/practicus-ai,https://www.crunchbase.com/organization/practicus-ai,2025-07-14 08:35:56.089475
Tektonic AI,Tektonic AI provides GenAI agents for business operations meant to automate complicated and dynamic tasks.,A startup focused on automating business operations using generative AI.,2023,10000000.0,seed,Nic Surpatanu|David Hsu,Madrona|Point72 Ventures,AI|Generative AI|Automation,Seattle,Washington,USA,"Tektonic utilizes generative AI in conjunction with traditional symbolic methods to facilitate workflow automation, enabling users to engage with AI agents through natural language interactions.",ai_workflow_automation,https://www.tektonic.ai/,https://www.linkedin.com/company/tektonic-ai,https://www.crunchbase.com/organization/tektonic-ai,https://techcrunch.com/2024/06/06/tektonic-ai-raises-10m-to-build-genai-agents-for-automating-business-operations/,2025-07-14 08:36:03.360294
